{
 "name": "prompt-b01-empty",
 "family": "agent",
 "authority": "pinned Pi packages/agent/src/harness (system-prompt.ts formatSkillsForSystemPrompt, skills.ts formatSkillInvocation), byte-copied; DIRECT_PI_PARITY",
 "pi_revision": "b7bb00b936dbe21b8e160b3e89efdec361846699",
 "requirements": [
  "HAR-002"
 ],
 "prompt_assembly": {
  "kind": "skills_block",
  "input": {
   "skills": []
  },
  "expected": ""
 }
}
