{
 "name": "prompt-v14-dirname",
 "family": "agent",
 "authority": "pinned Pi packages/agent/src/harness (system-prompt.ts formatSkillsForSystemPrompt, skills.ts formatSkillInvocation), byte-copied; DIRECT_PI_PARITY",
 "pi_revision": "b7bb00b936dbe21b8e160b3e89efdec361846699",
 "requirements": [
  "HAR-014"
 ],
 "prompt_assembly": {
  "kind": "invocation",
  "input": {
   "skill": {
    "name": "s",
    "description": "s description",
    "content": "# s\nbody",
    "file_path": "a\\b/c.md",
    "disable_model_invocation": false
   }
  },
  "expected": "<skill name=\"s\" location=\"a\\b/c.md\">\nReferences are relative to a\\b.\n\n# s\nbody\n</skill>"
 }
}
