{
 "name": "prompt-v94-pass-through",
 "family": "agent",
 "authority": "pinned Pi packages/agent/src/harness (system-prompt.ts formatSkillsForSystemPrompt, skills.ts formatSkillInvocation), byte-copied; DIRECT_PI_PARITY",
 "pi_revision": "b7bb00b936dbe21b8e160b3e89efdec361846699",
 "requirements": [
  "HAR-014"
 ],
 "prompt_assembly": {
  "kind": "invocation",
  "input": {
   "skill": {
    "name": "s",
    "description": "s description",
    "content": {
     "utf16": [
      120,
      13,
      10,
      55296,
      1
     ]
    },
    "file_path": "/skills/s/SKILL.md",
    "disable_model_invocation": false
   }
  },
  "expected": {
   "utf16": [
    60,
    115,
    107,
    105,
    108,
    108,
    32,
    110,
    97,
    109,
    101,
    61,
    34,
    115,
    34,
    32,
    108,
    111,
    99,
    97,
    116,
    105,
    111,
    110,
    61,
    34,
    47,
    115,
    107,
    105,
    108,
    108,
    115,
    47,
    115,
    47,
    83,
    75,
    73,
    76,
    76,
    46,
    109,
    100,
    34,
    62,
    10,
    82,
    101,
    102,
    101,
    114,
    101,
    110,
    99,
    101,
    115,
    32,
    97,
    114,
    101,
    32,
    114,
    101,
    108,
    97,
    116,
    105,
    118,
    101,
    32,
    116,
    111,
    32,
    47,
    115,
    107,
    105,
    108,
    108,
    115,
    47,
    115,
    46,
    10,
    10,
    120,
    13,
    10,
    55296,
    1,
    10,
    60,
    47,
    115,
    107,
    105,
    108,
    108,
    62
   ]
  }
 }
}
