{
 "name": "prompt-t16-multiline-dedupe-cross-tool",
 "family": "agent",
 "authority": "Minion model of pinned Pi coding-agent buildSystemPrompt + agent-session normalizers (tools-oracle.mjs; asserted removals of non-adopted text); MINION_EXTENSION, PP-14-5 Option B",
 "pi_revision": "b7bb00b936dbe21b8e160b3e89efdec361846699",
 "requirements": [
  "HAR-018"
 ],
 "prompt_assembly": {
  "kind": "tools_section",
  "input": {
   "tools": [
    {
     "name": "a",
     "snippet": "A",
     "guidelines": [
      "x\n\ny"
     ]
    },
    {
     "name": "b",
     "guidelines": [
      "x\n\ny",
      "z"
     ]
    }
   ]
  },
  "expected": "Available tools:\n- a: A\n\nGuidelines:\n- x\n\ny\n- z",
  "pi_reference": {
   "available_tools": "Available tools:\n- a: A",
   "guidelines": "Guidelines:\n- x\n\ny\n- z\n- Be concise in your responses\n- Show file paths clearly when working with files"
  }
 }
}
