{
 "name": "prompt-v91-additional",
 "family": "agent",
 "authority": "pinned Pi packages/agent/src/harness (system-prompt.ts formatSkillsForSystemPrompt, skills.ts formatSkillInvocation), byte-copied; DIRECT_PI_PARITY",
 "pi_revision": "b7bb00b936dbe21b8e160b3e89efdec361846699",
 "requirements": [
  "HAR-014"
 ],
 "prompt_assembly": {
  "kind": "invocation",
  "input": {
   "skill": {
    "name": "s",
    "description": "s description",
    "content": "# s\nbody",
    "file_path": "/skills/s/SKILL.md",
    "disable_model_invocation": false
   },
   "additional_instructions": "Do it now."
  },
  "expected": "<skill name=\"s\" location=\"/skills/s/SKILL.md\">\nReferences are relative to /skills/s.\n\n# s\nbody\n</skill>\n\nDo it now."
 }
}
