{
 "name": "prompt-t04-both-order",
 "family": "agent",
 "authority": "Minion model of pinned Pi coding-agent buildSystemPrompt + agent-session normalizers (tools-oracle.mjs; asserted removals of non-adopted text); MINION_EXTENSION, PP-14-5 Option B",
 "pi_revision": "b7bb00b936dbe21b8e160b3e89efdec361846699",
 "requirements": [
  "HAR-018"
 ],
 "prompt_assembly": {
  "kind": "tools_section",
  "input": {
   "tools": [
    {
     "name": "zeta",
     "snippet": "Z",
     "guidelines": [
      "gz"
     ]
    },
    {
     "name": "alpha",
     "snippet": "A",
     "guidelines": [
      "ga"
     ]
    }
   ]
  },
  "expected": "Available tools:\n- zeta: Z\n- alpha: A\n\nGuidelines:\n- gz\n- ga",
  "pi_reference": {
   "available_tools": "Available tools:\n- zeta: Z\n- alpha: A",
   "guidelines": "Guidelines:\n- gz\n- ga\n- Be concise in your responses\n- Show file paths clearly when working with files"
  }
 }
}
